{
  "check": "synthetic.test-only",
  "contract": "darwin.assessment-evidence/1",
  "criterion": "synthetic:criterion-a",
  "dataset": {
    "id": "synthetic:prcp-slice",
    "sha256": "efebedd1b0fb36bdbd35d1a0f94b585b99e5b4c8fa0adf4d739183ccd372e90f",
    "version": "synthetic1.1"
  },
  "details": {
    "synthetic": true
  },
  "evidence_type": "synthetic:test-receipt",
  "id": "darwin-evidence:9a86092e70654b83f8bc92f53656e3374dd422adb7aa58acad6faa719a6c9c5e",
  "outcome": "pass",
  "parameters": {},
  "requirements": {
    "id": "synthetic:requirements",
    "revision": "1",
    "sha256": "2127bfd3ce7bf8e7eb24b173ac93c8aba640e31c364094be46875e1877d0e6b0"
  },
  "software": {
    "check_implementation_sha256": "d5c818d8223e5dd9685e058b9f0678d90369cedf953b67d8613c19e66b88bc1c",
    "darwin": "1.2.0"
  },
  "synthetic": true
}
