{
  "check": "synthetic.test-only",
  "contract": "darwin.assessment-evidence/1",
  "criterion": "synthetic:criterion-a",
  "dataset": {
    "id": "synthetic:prcp-slice",
    "sha256": "efebedd1b0fb36bdbd35d1a0f94b585b99e5b4c8fa0adf4d739183ccd372e90f",
    "version": "synthetic1.1"
  },
  "details": {
    "synthetic": true
  },
  "evidence_type": "synthetic:test-receipt",
  "id": "darwin-evidence:f80df6d60c84b894f859a9fb020f1fac37f1ad428bdf13d19ff2ecdc80189987",
  "outcome": "pass",
  "parameters": {},
  "requirements": {
    "id": "synthetic:requirements",
    "revision": "1",
    "sha256": "ebd74747847471fa3997aad65621299194c9b8c2092c35adb96a4c8aae0dab50"
  },
  "software": {
    "check_implementation_sha256": "824663476002c0032d77d7a8653ba9bbcd3f8a2bbf7e23b987b15658cc5b3e88",
    "darwin": "1.2.0"
  },
  "synthetic": true
}
