{
  "check": "synthetic.test-only",
  "contract": "darwin.assessment-evidence/1",
  "criterion": "synthetic:criterion-a",
  "dataset": {
    "id": "synthetic:prcp-slice",
    "sha256": "efebedd1b0fb36bdbd35d1a0f94b585b99e5b4c8fa0adf4d739183ccd372e90f",
    "version": "synthetic1.1"
  },
  "details": {
    "synthetic": true
  },
  "evidence_type": "synthetic:test-receipt",
  "id": "darwin-evidence:df35205c72d1ea91e215480cc31113894ae922228a4b6a1d90ea24d5dc0a93bb",
  "outcome": "fail",
  "parameters": {},
  "requirements": {
    "id": "synthetic:requirements",
    "revision": "1",
    "sha256": "ebd74747847471fa3997aad65621299194c9b8c2092c35adb96a4c8aae0dab50"
  },
  "software": {
    "check_implementation_sha256": "be6bb9ebf6a75ba2a8afa5ac0f05fa3decb4b577f724920480f82dbb33772b15",
    "darwin": "1.2.0"
  },
  "synthetic": true
}
